{
  "started_at": "2026-05-10T07:29:19.100330+00:00",
  "finished_at": "2026-05-10T07:29:19.211719+00:00",
  "elapsed_seconds": 0.11136805219575763,
  "exit_code": 0,
  "environment": {
    "python_version": "3.12.3",
    "platform": "Linux-6.8.0-107-generic-x86_64-with-glibc2.35",
    "executable": "python3"
  }
}